{
  "schema_version": 1,
  "id": "rd_4k2m9q1z",
  "mode": "draft",
  "output_profile": "yt-1080p30",
  "started_at": "2026-10-03T11:00:00+07:00",
  "finished_at": "2026-10-03T11:02:00+07:00",
  "status": "done",
  "file": "renders/rd_4k2m9q1z/video.mp4",
  "duration_ms": 2700,
  "gate_results": [{ "gate": "graph_fresh", "pass": true }],
  "index_hash": "ff00000000000000000000000000000000000000000000000000000000000000"
}
